{
  "$schema": "https://json-schema.org/draft/2020-12/schema",
  "$id": "https://raw.githubusercontent.com/fellowAI2025/7d24h-templates/main/schemas/7d24h-template-categories.v1.schema.json",
  "title": "categories.json (7d24h-template-categories/v1)",
  "description": "Generated by tools/schemas.mjs from tools/lib/schema.mjs; do not edit.",
  "type": "object",
  "properties": {
    "schema": {
      "enum": [
        "7d24h-template-categories/v1"
      ]
    },
    "spage": {
      "type": "array",
      "items": {
        "type": "object",
        "properties": {
          "id": {
            "type": "string",
            "minLength": 1,
            "maxLength": 40,
            "pattern": "^[a-z][a-z0-9-]{1,62}$"
          },
          "label": {
            "type": "string",
            "minLength": 1,
            "maxLength": 60
          },
          "labelZh": {
            "type": "string",
            "minLength": 1,
            "maxLength": 60
          }
        },
        "required": [
          "id",
          "label",
          "labelZh"
        ],
        "additionalProperties": false
      },
      "maxItems": 40
    },
    "typage": {
      "type": "array",
      "items": {
        "type": "object",
        "properties": {
          "id": {
            "type": "string",
            "minLength": 1,
            "maxLength": 40,
            "pattern": "^[a-z][a-z0-9-]{1,62}$"
          },
          "label": {
            "type": "string",
            "minLength": 1,
            "maxLength": 60
          },
          "labelZh": {
            "type": "string",
            "minLength": 1,
            "maxLength": 60
          }
        },
        "required": [
          "id",
          "label",
          "labelZh"
        ],
        "additionalProperties": false
      },
      "maxItems": 40
    },
    "mpage": {
      "type": "array",
      "items": {
        "type": "object",
        "properties": {
          "id": {
            "type": "string",
            "minLength": 1,
            "maxLength": 40,
            "pattern": "^[a-z][a-z0-9-]{1,62}$"
          },
          "label": {
            "type": "string",
            "minLength": 1,
            "maxLength": 60
          },
          "labelZh": {
            "type": "string",
            "minLength": 1,
            "maxLength": 60
          }
        },
        "required": [
          "id",
          "label",
          "labelZh"
        ],
        "additionalProperties": false
      },
      "maxItems": 40
    }
  },
  "required": [
    "schema",
    "spage",
    "typage",
    "mpage"
  ],
  "additionalProperties": false
}
